{
  "eventType": "AGENT_STEP",
  "schemaVersion": 1,
  "eventId": "ad1e2f3a-4b5c-4d6e-8f7a-0b1c2d3e4f5b",
  "traceId": "1c2d3e4f-0a1b-4c2d-8e3f-4a5b6c7d8e9f",
  "tripId": "9ee5e831-90f7-4a60-bb8d-fb488aa799ca",
  "runId": "5a1b2c3d-4e5f-4a6b-8c9d-0e1f2a3b4c5d",
  "occurredAt": "2026-08-29T08:29:30Z",
  "payload": {
    "seq": 0,
    "tool": "ask_user",
    "ok": true,
    "summary": "你想去哪个城市？"
  }
}
